JobID	GroupID	Title	Description	Requirements	City	State	Country	Zip5	StartDate	EndDate
738	1	CDL A Flatbed OTR Drivers	<p>CDL A Flatbed OTR Drivers </p> <p> CB325713 Various </p> <p>1-800-793-3754</p> <p><b>Ryder</b> -  </p> <p>EXCELLENT OTR OPPORTUNITIES! CDL A Flatbed OTR Drivers Needed. Great Benefits and Home Weekends. Class A CDL w/1 yr exp. Call 1-800-793-3754. www.ryder.jobs EOE. Drug test req for employment </p> <p>                                 \n                \n                 <br><br>Source - Chicago Tribune	Please refer to the Job Description to view the requirements for this job	Chicago	IL	US	60606	2012-03-04 05:18:56.353	2012-04-03 23:59:59
739	1	Education Openings	<p>Education Openings </p> <p> CB333649 Chicago, IL  </p> <p>online</p> <p><b>Francis W. Parker School</b> -  </p> <p>DIVERSITY JOB FAIR For Teachers of Color. Saturday, March 10, 2012. 9:00 a.m. to 12:00 p.m. Meet with private school reps to learn more about their programs and open positions. To register or for more info please visit <a href="http://www.fwparker.org">www.fwparker.org</a> or call 773.797.5103</p> <p>                                 \n                \n                 <br><br>Source - Chicago Tribune	Please refer to the Job Description to view the requirements for this job	Chicago	IL	US	60606	2012-03-04 05:18:57.11	2012-04-03 23:59:59
740	1	Psychologist/LICSW	<p>Psychologist/LICSW </p> <p> CB329149 Elkins, WV </p> <p> <a href="mailto:rkiley@achcinc.org">rkiley@achcinc.org</a></p> <p><b>APPALACHIAN COMMUNITY HEALTH CENTER </b> -  </p> <p>seeks a Psychologist or LICSW. Must be lic'd to practice in West Virginia. Mental health experience req'd. For more information please e-mail CV with ref's to <a href="mailto:rkiley@achcinc.org">rkiley@achcinc.org</a>. EOE</p> <p>                                 \n                \n                 <br><br>Source - Chicago Tribune	Please refer to the Job Description to view the requirements for this job	Elkins	WV	US	26241	2012-03-04 05:19:01.82	2012-04-03 23:59:59
741	1	Product Dvlpmnt Eng Team Lead	<p>Product Dvlpmnt Eng Team Lead </p> <p> CB329724 Lisle </p> <p><a href="http://www.navistar.com">www.navistar.com</a></p> <p><b>Navistar, Inc.</b> -  </p> <p>is seeking a Product Development Engineer Team Lead in Lisle, IL with the following requirements: Master's degree in Electrical Engineering or foreign academic equivalent plus 3 years of experience or Bachelor's degree in Electrical Engineering or foreign academic equivalent plus 5 years of experience. Experience must include: develop software control algorithms for engine interfaces to automatic transmissions for vehicle and engine speed management and Power Take off Systems, and for fuel economy optimization and Heavy Duty OBD monitors. </p> \r\n  \r\n <p>Please apply at <a href="http://www.navistar.com">www.navistar.com</a> and refer to Job ID 16657.</p> <p>                                 \n                \n                 <br><br>Source - Chicago Tribune	Please refer to the Job Description to view the requirements for this job	Lisle	IL	US	60532	2012-03-04 05:19:02.663	2012-04-03 23:59:59
742	1	Sales Representative	Are you ready for something new? Are you tired of your current job and not making any real money?\r\nComplete Home Experts is looking for sales people who are tired of making average or below average money.\r\nIf you want to make the great money you deserve, and change your lifestyle into what you want, then call us.\r\nWe are filling 10 positions for this quarter.\r\n\r\nExcellent Customer Service is a must.\r\nAttention to detail is a must.\r\n\r\nOur craftsmanship makes referrals easy!	QUALIFICATIONS\r\n*MOTIVATED with strong desire to win\r\n*Excellent presentation and communication skills\r\n*Strong work ethic\r\n*Professional appearance with sound business ethics\r\n*Must have a valid driver's lic.\r\n\r\nCompensation\r\nTop Commisions plus bonuses\r\nHealth Care Insurance (Blue Cross Blue Shield) after 90 days\r\nPhone Allowance\r\n\r\nNo previous experience required. WE TRAIN YOU! Our home representatives are responsible for educating homeowners about the most common types of storm damage, and ensuring proper funding by their insurance companies. \r\n\r\n***Must own your own vehicle, cell phone, ladder, and computer.***\r\n\r\nCall 312-339-2025 & ask for Fred.\r\n\r\nhttp://completehomeexperts.com\r\n\r\n<b>Source - Chicago Tribune</b>\r\n\r\n\r\n\r\n\r\n\r\n\r\n\r\n\r\n\r\n\r\n\r\n\r\n\r\n\r\n\r\n\r\n\r\n\r\n\r\n\r\n\r\n\r\n\r\n\r\n\r\n\r\n\r\n\r\n\r\n\r\n\r\n\r\n\r\n\r\n\r\n\r\n\r\n\r\n\r\n\r\n\r\n\r\n\r\n\r\n\r\n\r\n\r\n\r\n\r\n\r\n\r\n\r\n\r\n\r\n\r\n\r\n\r\n\r\n\r\n\r\n\r\n\r\n\r\n\r\n\r\n\r\n\r\n\r\n\r\n\r\n\r\n\r\n\r\n\r\n\r\n\r\n\r\n\r\n\r\n\r\n\r\n\r\n\r\n\r\n\r\n\r\n\r\n\r\n\r\n\r\n\r\nKeyword Search: Roofing, Roofing Sales, Outside Sales, Siding Sales, Siding, Construction, Remodeling, Room Additions, Self Starter, Entry Level, College Grads, Plumbers, Carpenters, Electricians, Insurance Adjusters, Claim adjusters, House inspectors, Handyman, Sales Rep, field Inspectors, adjusters, insurance adjusters, canvassers	Chicago	IL	US		2012-03-04 05:19:03.57	2012-04-03 23:59:59
743	1	Experienced Route Driver	<p>Experienced Route Driver  </p> <p> CB335088 Chicago  </p> <p>Email or Fax Resume </p> <p><b>AvCoa vending </b> -  </p> <p>Is looking for an experienced route driver email resume to <a href="mailto:hcomitor@avcoavending.com">hcomitor@avcoavending.com</a> or </p> \r\n <p>Fax to 312-226-6269</p> <P>                                 \r\n                \r\n                 <BR><BR>Source - Chicago Tribune	Please refer to the Job Description to view the requirements for this job	Chicago	IL	US	60612	2012-03-08 01:22:10.853	2012-04-07 23:59:59
744	1	Accounting/Bookkeeper	<p>Accounting/Bookkeeper </p> <p> CB335116 Chicago, IL  </p> <p><a href="mailto:nationalplazas12@aol.com">nationalplazas12@aol.com</a></p> <p><b>Commercial general contractor </b> -  </p> <p>for downtown Chicago office. Must be very experienced in Accounts Payable, Skyline and lien waiver examination. \r\n\r\nSend resume to: </p> \r\n <p><a href="mailto:nationalplazas12@aol.com">nationalplazas12@aol.com</a></p> <p>                                 \r\n                \r\n                 <br /><br />Source - Chicago Tribune	Please refer to the Job Description to view the requirements for this job	Chicago	IL	US	60606	2012-03-07 16:33:45.697	2012-04-06 23:59:59
745	1	Maintenance Specialist	Summit  janet.treder@owenscorning.com Maintenance Specialist  CB028692 Owens Corning  - Mechanical / Electrical Owens Corning?s Roofing and Asphalt Plant have immediate openings for Maintenance Specialists with a minimum 3 years experience. The positions  are in a manufacturing environment with full benefits and matching 401K. Pay from $21.56 to $28.24 depending on skill. Candidates should send resumes to 5824 S. Archer Rd, Summit, IL 60501. High school or GED required. EOE/MFVD Do Not Accepted in Person<P>                                 \n                \n                 <BR><BR>Source - Chicago Tribune	Please refer to the Job Description to view the requirements for this job	Summit	IL	US	60501	2012-03-09 01:11:35.127	2012-04-08 23:59:59
746	1	Maint. Tech - Mech/Elec	<p>Maintenance Tech </p> <p> CB326844 North Side </p> <p>Apply at <a href="http://www.hu-friedy.com">www.hu-friedy.com</a></p> <p> -  </p> <p>Mechanical/Electrical. Hydraulics, pneumatics experience.  </p> <P>                                 \n                \n                 <BR><BR>Source - Chicago Tribune	Please refer to the Job Description to view the requirements for this job	Chicago	IL	US	60618	2012-03-09 16:18:57.843	2012-04-08 23:59:59
747	1	Inside Sales	<p>Inside Sales </p> <p> CB328790 East Chicago, IN </p> <p>Fax: 734-452-3919</p> <p><b>Steel srv ctr</b> -  </p> <p>Exp. w/ steel/inside/cust svc in ind. env pref'd. Excel. math, phone, orgztnl, & comm. skills. </p> <P>                                 \n                \n                 <BR><BR>Source - Chicago Tribune	Please refer to the Job Description to view the requirements for this job	Chicago	IL	US		2012-03-10 01:12:33.997	2012-04-09 23:59:59
748	1	Assistant Rector	<p>Assistant Rector </p> <p> CB317750 Trenton, MI </p> <p>Apply by Mail</p> <p> - </p> <p>The Trustees of an historic church serving a large Midwestern city seek an ordained priest or minister to join our ministry team. We observe traditional, biblically based worship (1928 BCP) supported by a professional choir. Candidates must have formal seminary training; provide evidence of leadership skills; be committed to continue our traditional services. Interested parties should submit a letter of interest and resume to Search Committee, P.O. Box 320, Trenton, MI 48183. </p> <P>                                 \r\n                \r\n                 <BR><BR>Source - Chicago Tribune	Please refer to the Job Description to view the requirements for this job	Trenton	MI	US	48183	2012-03-11 05:18:57.047	2012-04-10 23:59:59
749	1	Business Finance Manager	SEARS HOLDINGS MANAGEMENT CORPORATION - Business Finance Manager – Store Analytics, Hoffman Estates, IL. Responsible for working with and supporting the Retail Services organization (Front Line Supervisor and Kmart), providing store level analytics, sales and margin store planning and ad-hoc analysis of various tests as necessary. Must possess a minimum of a Bachelor’s degree in Finance, Accounting or related field plus 5 years of experience performing financial analysis and forecasting/budgeting for a large number of units. For a complete description of the job duties and requirements, please apply on-line at www.searsholdings.com/careers. Under “Search Professional and Salaried Jobs” select “Search for Corporate Jobs”. Please refer to Requisition Number 109738BR.	Please refer to the Job Description to view the requirements for this job	Hoffman Estates	IL	US	60192	2012-03-11 05:18:57.483	2012-04-10 23:59:59
750	1	SALES / MARKETING	<p>SALES / MARKETING </p> <p> CB335121 Tinley Park, IL </p> <p>By Mail </p> <p><b>SW suburban manufacturing company</b> -  </p> <p>seeks person with strong sales experience to introduce new "green" product to distribution, logistics and warehousing facilities. Experience and contacts within national big box and chain stores as well as major suppliers to those stores required. This is a new pro-active position targeting specific markets from within our Tinley Park IL facility. This is not a telemarketing position. Travel "as needed". Excellent salary and fringe benefits. This is a non-commission paid position with annual performance bonus potential. Please \r\n\r\nSend resume to: </p> \r\n <p>Aero Rubber Company, Inc. </p> \r\n <p>P.O. Box 1247 </p> \r\n <p>Tinley Park, IL 60477</p> <P>                                 \r\n                \r\n                 <BR><BR>Source - Chicago Tribune	Please refer to the Job Description to view the requirements for this job	Tinley Park	IL	US	60477	2012-03-11 05:18:59.23	2012-04-10 23:59:59
751	1	Multiple Positions	<p>Healthcare</p> \r\n  \r\n <p>SHARING A VISION</p> \r\n  \r\n <p>Franciscan St. Anthony Health in Crown Point, Indiana has a vision for healthier communities, but it's our nurses, physicians and staff who bring it to life. Share our passion for providing superior patient care and see how our mission of faith can bring deeper rewards to every aspect of your career. </p> \r\n  \r\n <p>Director of Burrell Cancer Institute </p> \r\n <p>Bachelor of Arts or Science required in appropriate discipline. Master's preferred in Business Administration/Health Management. 5 years progressive clinical experience in Breast Care Center, Radiation Oncology or Outpatient Services with an additional 3 to 5 years supervisory skills required. </p> \r\n  \r\n <p>OB Clinical Nurse Educator </p> \r\n <p>Master's degree in Nursing required. 5 years experience in OB or NICU and certification preferred. Must be able to travel between St. Anthony Crown Point and St. Margaret's in Dyer. </p> \r\n  \r\n <p>Clinical Nurse Specialist - Critical Care </p> \r\n <p>MSN required. CNS or CNS eligible and obtained in 6 months. 3 to 5 years or recent experience in area of clinical specialty. Current licensure as a registered nurse in the State of Indiana. Current certification in area of specialty preferred. </p> \r\n  \r\n <p>Occupational Therapist </p> \r\n <p>Full-time for Acute Care/IP Rehab; Bachelor's degree in Occupational Therapy. Licensed or eligible for licensure in the State of Indiana required. </p> \r\n  \r\n <p>Experience the rewards that come with being part of the Franciscan Alliance family, along with a competitive salary and extraordinary benefits. To learn more and to apply, visit: <a href="http://www.stanthonymedicalcenter.com">www.stanthonymedicalcenter.com</a>. EOE M/F/D/V</p> \r\n  \r\n <p>Franciscan St. Anthony Health Crown Point</p> \r\n  \r\n <p><a href="http://www.stanthonymedicalcenter.com">www.stanthonymedicalcenter.com</a>                Web CB329748   </p> <P>                                 \n                \n                 <BR><BR>Source - Chicago Tribune	Please refer to the Job Description to view the requirements for this job	Crown Point	IN	US	46307	2012-03-11 05:19:02.723	2012-04-10 23:59:59
752	1	Transportation Manager	<p>Transportation Manager  </p> <p> CB330532 Chicago  </p> <p>Call 708-263-1207</p> <p><b>Confidential </b> -  </p> <p>Transportation manager for International Travel Clubs Corp. Not Trucking FT Chicago locatio. Must have extensive supervision or management background. </p> \r\n <p>Excellent Salary package. Call 708-263-1207</p> <P>                                 \n                \n                 <BR><BR>Source - Chicago Tribune	Please refer to the Job Description to view the requirements for this job	Chicago	IL	US	60611	2012-03-14 01:14:38.277	2012-04-13 23:59:59
753	1	Tool & Die Maker	<p>Tool & Die Maker </p> <p> CB319209 Newport, AR </p> <p><a href="mailto:paulas@sspforge.com">paulas@sspforge.com</a></p> <p><b>Southwest Steel Processing</b> -  </p> <p>Mid-Size Manufacturing Co. In Newport, Arkansas looking for Tool and die maker to oversee die shop. Ability to use precision measuring tools a must. Solid works exp. preferred Salary compensatory with exp. Re-location package available \r\n\r\nSend resume to: Human Resource Manager 4900 Lighthouse Dr. Newport, Ar. 72112 Or e-mail. </p> <P>                                 \n                \n                 <BR><BR>Source - Chicago Tribune	Please refer to the Job Description to view the requirements for this job	Newport	AR	US	72112	2012-03-18 01:22:34.36	2012-04-17 23:59:59
754	1	Job Fair	<p>Job Fair </p> <p> CB319651 Orland Park, IL </p> <p><a href="http://www.berkotfoods.com">www.berkotfoods.com</a> </p> <p><b>Berkot's Super Foods</b> -  </p> <p>Now Hiring All Positions! Job Fair. Saturday, March 31. 9am - 12pm. Wolf Point Crossing Plaza 11267 West 159th, Orland Park, IL 60467</p> \r\n <p>Fill out an application at <a href="http://www.berkotfoods.com">www.berkotfoods.com</a> </p> \r\n <P>                                 \n                \n                 <BR><BR>Source - Chicago Tribune	Please refer to the Job Description to view the requirements for this job	Orland Park	IL	US	60467	2012-03-16 14:03:59.09	2012-04-15 23:59:59
755	1	Engineer	<p> Engineer </p> <p> CB331730 South Beloit, IL </p> <p>815-624-7797</p> <p><b>Advanced Engineered Systems, INc</b> -  </p> <p>located in South Beloit, Illinois has realized significant growth in a variety of markets and is currently hiring for several positions, such as Engineering Manager, Mechanical Engineer and Controls Engineer. Advanced Engineered Systems, Inc. is an Equal Opportunity Employer offering a competitive wage and benefit package. Please email resumes to <a href="mailto:employment@advengsys.com">employment@advengsys.com</a> or call 815-624-7797.</p> <P>                                 \n                \n                 <BR><BR>Source - Chicago Tribune	Please refer to the Job Description to view the requirements for this job	South Beloit	IL	US	61080	2012-03-18 01:22:36.273	2012-04-17 23:59:59
756	1	Project Engineering	<p>Project Engineering </p> <p> CB319045 Chicago </p> <p>312-733-6262</p> <p><b>GSG CONSULTANTs inc</b> -  </p> <p>Perform subsurface exp. & eng. analyses for shallow/deep foundations/earth ret. systems; Perform environmental site assessments; supervise remediation projects; Prepare proposals/cost est.; Project mgmt; Perform laboratoy soil testing, incl. triaxial & lab test results w/in-house software. Min. req. MS in Civil Eng w/ major in Geo-Environ. + 4 yrs rel. work exp. & PE license. Resume to: 855 W. Adams St., Ste. 200, Chicago, IL 60607. Attn: Ala E. Sassila </p> <P>                                 \n                \n                 <BR><BR>Source - Chicago Tribune	Please refer to the Job Description to view the requirements for this job	Chicago	IL	US	60605	2012-03-17 05:18:52.49	2012-04-16 23:59:59
757	1	System Analyst	<p>System Analyst </p> <p> CB327856 Lincolnshire, IL </p> <p>By Mail, Phone, Email</p> <p><b>Anavia LLC</b> -  </p> <p>And other client locations: Perform technical and functional analysis, systems support, analyze, design specification, configuration, testing, documentation, and implementation using SAP R/3 ECC, SAP modules such as SD, MM, PP, FI, CO, SCM, and CRM, ABAP/4, ALV Reports, BAPI, IDOC, BDC, EDI, ALE, C, C++, Java, Oracle8i, SQL Server, Unix, and Windows NT/2000/XP. MS in CS, CIS, MIS, Engineering (any field), or related with one year of experience. Salary DOE. Mail resume to Anavia, LLC, 175 Olde Half Day Road, Suite 100-12, Lincolnshire, IL-60069 or email: </p> \r\n <p><a href="mailto:jobs@anaviatech.com">jobs@anaviatech.com</a>. </p> <P>                                 \r\n                \r\n                 <BR><BR>Source - Chicago Tribune	Please refer to the Job Description to view the requirements for this job	Lincolnshire	IL	US	60069	2012-03-18 05:18:54.787	2012-04-17 23:59:59
758	1	Outreach Representative	<p>Outreach Representative </p> <p> CB327816 Chicago, IL </p> <p>Apply by mail</p> <p><b>ISMIE Mutual Insurance Company </b> -  </p> <p>The Outreach Representative, in conjunction with various marketing initiatives and organization leadership, will promote the Illinois State Medical Society brand, in addition to retention and recruitment efforts through aggressive and proactive grassroots activity. </p> \r\n <p>B.A. or B.S. degree or equivalent experience required, with at least 2 years of experience in an association organization, outside sales or communications/PR field. The ideal candidate will have a strong professional demeanor and excellent written and verbal communication skills, with the ability to be flexible and travel extensively throughout the state of Illinois. Experience in governmental relations is a plus. </p> \r\n <p>\r\n\r\nPlease send resumes with cover letter to: ISMIE Mutual Insurance Company - HR/OR, 20 North Michigan Ave., Suite 700, Chicago, IL 60602. No phone calls, please. eoe </p> <P>                                 \n                \n                 <BR><BR>Source - Chicago Tribune	Please refer to the Job Description to view the requirements for this job	Chicago	IL	US	60602	2012-03-18 05:18:56.473	2012-04-17 23:59:59
759	1	Sr Associate, Acquisition Pricing	Discover Products Inc seeks Sr Associate, Acquisition Pricing in Riverwoods, IL to dvlp, optimize, analyze & impl strategies focusing on Risk mgmt areas, to increase net profitability while maintaining acceptable risk profile. Req: Master's in Math, Econ, Stats, Fin, Bus. Admin or rel., or equiv & 1 yr exp providing risk analytics reporting for fin'l srvcs firm; dvlpg, optimizing, analyzing & impl'g risk mgmt strategies; & utiliz'g advanced analytics tools, such as SAS, SQL, & Teradata. For consideration email resume to </p> \r\n <p><a href="mailto:josetolentino@discover.com">josetolentino@discover.com</a> ref. Job ID 19432-CHT. No calls pls. We offer competitive salaries & comprehensive benefits program. EOE. </p> <P>                                 \r\n                \r\n                 <BR><BR>Source - Chicago Tribune	Please refer to the Job Description to view the requirements for this job	Riverwoods	IL	US		2012-03-18 05:18:57.89	2012-04-17 23:59:59
760	1	President	<p>President </p> <p> CB336575 Midwest </p> <p>Mail</p> <p> -  </p> <p>Growing vinyl window & door manufacturer in upper Midwest seeking experience executive (5-10 yrs) to provide strategic direction to achieve goals and profitability targets, driving our continued success. Ability to cultivate trusted relationships within all levels of interaction, internal & external, using sound business practices. Please send your resume to:</p> \r\n <p> P.O. Box 803883, 581 Chgo, Il 60680 </p> \r\n  \r\n <P>                                 \n                \n                 <BR><BR>Source - Chicago Tribune	Please refer to the Job Description to view the requirements for this job	Sauk Rapids	MN	US	56379	2012-03-18 05:19:02.307	2012-04-17 23:59:59
761	1	Multiple Positions	<p>Dovenmuehle</p> \r\n  \r\n <p>Dovenmuehle Mortgage, Inc., one of the nation's oldest and most respected mortgage servicing companies, currently has opportunities available at both our Elgin and Lake Zurich facilities for: </p> \r\n  \r\n <p>Foreclosure Manager </p> \r\n <p>Bankruptcy Specialist </p> \r\n <p>Foreclosure Specialist </p> \r\n <p>Quality Control </p> \r\n <p>Loss Mitigation Supervisor </p> \r\n <p>Loss Mitigation Specialist </p> \r\n <p>Collection Counselor (FT & PT) </p> \r\n <p>Default Litigation </p> \r\n <p>Default Reporting </p> \r\n <p>Loan Servicing </p> \r\n <p>Release Processor</p> \r\n  \r\n <p>Qualified candidates for these positions should possess good analytical skills; strong organizational skills; and strong attention to detail along with excellent verbal and written communication skills, PC proficiency, and good data entry skills. </p> \r\n  \r\n <p>E-mail resume w/salary requirements to: </p> \r\n <p><a href="mailto:dmijobs@dmicorp.com">dmijobs@dmicorp.com</a> </p> \r\n  \r\n <p>EOE/M/F/D/V                Web CB336585   </p> <P>                                 \n                \n                 <BR><BR>Source - Chicago Tribune	Please refer to the Job Description to view the requirements for this job	Schaumburg	IL	US	60173	2012-03-18 05:19:03.18	2012-04-17 23:59:59
762	1	Drivers CDL-A	<p>Maines Paper & Food Service, Inc.</p> \r\n  \r\n <p>We Are Hiring!</p> \r\n  \r\n <p>Drivers - Now Hiring CDL-A Qualified Drivers in Hanover Park, IL due to New Business & consistent growth. Looking for drivers with a CDL-A license, 1 year of driving experience, with a positive, ready for anything attitude. Must be able to lift at least 50 lbs. Driver Referral Bonus of $1,000! </p> \r\n  \r\n <p>Other Positions available: Transportation Manager, Warehouse Order Selectors, Reach Truck Operators, Stand Up Forklift Operators and Loaders. </p> \r\n  \r\n <p>Other benefits include medical, dental and vision insurance, 401k with company-match and profit sharing, Company paid Life Insurance and paid vacation, sick and holidays. </p> \r\n  \r\n <p>Apply In Person At: 6425 Muirfield Drive, Hanover Park, IL 60133 or call us at 1-800-704-4348 ext 2 to for more information & schedule your appointment for an interview.                 Web CB331037   </p> <P>                                 \n                \n                 <BR><BR>Source - Chicago Tribune	Please refer to the Job Description to view the requirements for this job	Hanover Park	IL	US	60133	2012-03-18 05:19:03.737	2012-04-17 23:59:59
763	1	RNs	<p>RNs </p> <p> CB309541 Bolingbrook, IL </p> <p>800-772-4376</p> <p><b>ADVANTIS OCCUPATIONAL HEALTH </b> -  </p> <p>seeking a RN able </p> \r\n <p>to work autonomously at an on-site industrial setting clinic. </p> \r\n <p>Position is long-term w/benefits. Responsible to provide emergency/non-emergency care, assessments, triage &</p> \r\n <p>appropriate medical treatment. Req: Active IL RN Lic; </p> \r\n <p>1-2 years Occ. Health/ER/Med/Surg/ICU; computer exp. </p> \r\n <p>For immediate consideration please contact Christine at </p> \r\n <p>(800) 772-4376, or fax resume to (248) 334-0022.</p> <P>                                 \n                \n                 <BR><BR>Source - Chicago Tribune	Please refer to the Job Description to view the requirements for this job	Bolingbrook	IL	US	60440	2012-03-18 05:19:04.303	2012-04-17 23:59:59
769	1	Procurement/trans. Mgr.	Procurement/trans. Mgr.  CB330412 Elk Grove Village,IL                     resumes@clearlam.com CLEAR LAM PACKAGING  \r\nThis position is responsible for the materials planning, sourcing, purchasing and transportation for raw materials, packaging and manufacturing supplies. Additional responsibilities include transportation of finished goods. This position will continually seek out the highest quality, most cost effective procurement solutions for the organization. As an integral part of the Supply Chain Team, This position will operate closely with other departments to improve internal business processes. 5+ yrs. BA, procurement experience, strong negotiating and problem solving skills. Experience with LTL, FTL, Air, Rail and Ocean transport. Some plastics manufacturing. Experience Preferred. Excellent wage and benefit pkg. including 401K. Send resume and salary history to: HR or apply Mon-Fri 9a-3p Clear Lam Packaging 1900 Pratt Blvd Elk Grove Village, IL 60007 Fax: 224-265-6576  mailto:resumes@clearlam.com">resumes@clearlam.com\r\n EOE M/F/D/V</p> <P>                                 \r\n                \r\n          Chicago Tribune	Please refer to the Job Description to view the requirements for this job	Chicago	IL	US	60606	2012-03-23 17:48:59.08	2012-04-22 23:59:59
